{
  "schema_version": "1.0.0",
  "id": "EVD-WP-2026-0131-G07-source-change",
  "work_package_id": "WP-2026-0131",
  "gate": "G07",
  "claim": "the change WP-2026-0131 makes to this repository, outside its own directory and the lockfile",
  "evidence_type": "source-change",
  "producer": {
    "id": "badf-self-dossier",
    "type": "controller"
  },
  "source_revision": "HEAD",
  "target": "bstBizEra/badf:main",
  "toolchain": {
    "name": "git diff",
    "version": "1"
  },
  "operation": "git diff",
  "started_at": "2026-09-01T21:07:27Z",
  "completed_at": "2026-09-01T21:07:27Z",
  "outcome": "PASS",
  "artifact": "work/WP-2026-0131/evidence/G07/source-change.diff",
  "digest": "sha256:5ad1b8c4523e35208169b99b0c868a08045be48f2d6ae850463c50e527ee5bb1",
  "binding": {
    "base_sha": "75a6abd46c28033332aa19553a083b50d9ce06ec",
    "head_sha": "885712eb1b06e759ea7aec39e5e45306650cc27d",
    "content_tree": "b6ec254f98d763bf3a88c43476af3393b7fa151b",
    "changed_paths": [
      "badf/demands/BADF-DEM-0118.json",
      "badf/skill-registry.json",
      "docs/governance/GITHUB_CONTROL_PLANE.md",
      "examples/uat-shadow-checkout-rejected.json",
      "examples/uat-shadow-checkout.json",
      "examples/uat-shadow-checkout.log",
      "skills/badf-uat/references/acceptance.md",
      "skills/badf-uat/references/shadow-evidence.md",
      "tests/test_badf_uat_contract.py",
      "tests/test_badf_uat_shadow.py",
      "work/WP-2026-0133/work-package.json"
    ],
    "expected_surfaces": {
      "declared": true,
      "files": [
        "badf/demands/BADF-DEM-0118.json",
        "badf/skill-registry.json",
        "docs/governance/GITHUB_CONTROL_PLANE.md",
        "examples/uat-shadow-checkout-rejected.json",
        "examples/uat-shadow-checkout.json",
        "examples/uat-shadow-checkout.log",
        "skills/badf-uat/references/acceptance.md",
        "skills/badf-uat/references/shadow-evidence.md",
        "tests/test_badf_uat_contract.py",
        "tests/test_badf_uat_shadow.py",
        "work/WP-2026-0133/work-package.json"
      ]
    },
    "unexpected_paths": [],
    "change_digest": "sha256:5ad1b8c4523e35208169b99b0c868a08045be48f2d6ae850463c50e527ee5bb1"
  }
}
