{
  "schema_version": "1.0.0",
  "id": "EVD-WP-2026-0124-G07-source-change",
  "work_package_id": "WP-2026-0124",
  "gate": "G07",
  "claim": "the change WP-2026-0124 makes to this repository, outside its own directory and the lockfile",
  "evidence_type": "source-change",
  "producer": {
    "id": "badf-self-dossier",
    "type": "controller"
  },
  "source_revision": "HEAD",
  "target": "bstBizEra/badf:main",
  "toolchain": {
    "name": "git diff",
    "version": "1"
  },
  "operation": "git diff",
  "started_at": "2026-08-31T18:35:49Z",
  "completed_at": "2026-08-31T18:35:49Z",
  "outcome": "PASS",
  "artifact": "work/WP-2026-0124/evidence/G07/source-change.diff",
  "digest": "sha256:73297127538322725180b327880d8c78dc14dba5d0dd591a74b017ec8dffe9bd",
  "binding": {
    "base_sha": "292d1beba0e97e680323788228d27bfb8b425fe9",
    "head_sha": "670b58630e63a667bdeb0e1f6775de03881e0fab",
    "content_tree": "856b62ed666b8c9d88b5ebb579537ac1973a8b89",
    "changed_paths": [
      "badf/demands/BADF-DEM-0110.json",
      "badf/skill-registry.json",
      "docs/governance/GITHUB_CONTROL_PLANE.md",
      "schemas/uat.schema.json",
      "scripts/badf_gate.py",
      "skills/badf-uat/SKILL.md",
      "tests/test_badf_production_readiness_contract.py",
      "tests/test_badf_uat_contract.py",
      "tests/test_badf_uat_evidence.py",
      "work/WP-2026-0122/work-package.json"
    ],
    "expected_surfaces": {
      "declared": true,
      "files": [
        "badf/demands/BADF-DEM-0110.json",
        "badf/skill-registry.json",
        "docs/governance/GITHUB_CONTROL_PLANE.md",
        "schemas/uat.schema.json",
        "scripts/badf_gate.py",
        "skills/badf-uat/SKILL.md",
        "tests/test_badf_production_readiness_contract.py",
        "tests/test_badf_uat_contract.py",
        "tests/test_badf_uat_evidence.py"
      ]
    },
    "unexpected_paths": [
      "work/WP-2026-0122/work-package.json"
    ],
    "change_digest": "sha256:73297127538322725180b327880d8c78dc14dba5d0dd591a74b017ec8dffe9bd"
  }
}
